capitulo,leccion,dificultad,enunciado,opcion_a,opcion_b,opcion_c,opcion_d,respuesta_correcta,explicacion
Curvas,Ecuaciones paramÃĐtricas,facil,"Dada la curva parametrica $x = t^2 - 2t$, $y = t + 1$, Âŋcual es el punto $(x, y)$ cuando $t = 0$?","$(0, 1)$","$(1, 0)$","$(-2, 1)$","$(0, -1)$",A,"Sustituyendo $t = 0$: $x = 0 - 0 = 0$, $y = 0 + 1 = 1$. El punto es $(0, 1)$."
Curvas,Ecuaciones paramÃĐtricas,facil,"Las ecuaciones parametricas $x = \cos t$, $y = \sin t$ con $0 \le t \le 2\pi$ describen:",Una elipse centrada en el origen,Una circunferencia de radio 1 centrada en el origen,Una parabola con vertice en el origen,Una recta que pasa por el origen,B,"Al eliminar el parametro: $x^2 + y^2 = \cos^2 t + \sin^2 t = 1$, que es una circunferencia de radio 1."
Curvas,Ecuaciones paramÃĐtricas,facil,"Para la curva $x = t^2 - 2t$, $y = t + 1$, al eliminar el parametro se obtiene:",$x = y^2 + 4y + 3$,$x = y^2 + 4y - 3$,$x = y^2 - 4y + 3$,$x = y^2 - 4y - 3$,C,De $y = t+1$ se obtiene $t = y-1$. Sustituyendo: $x = (y-1)^2 - 2(y-1) = y^2 - 4y + 3$.
Curvas,Ecuaciones paramÃĐtricas,facil,"ÂŋCual es la pendiente de la recta tangente a una curva parametrica $x = f(t)$, $y = g(t)$?",$\frac{dx}{dy} = \frac{f'(t)}{g'(t)}$,$\frac{dy}{dx} = \frac{f'(t)}{g'(t)}$,$\frac{dy}{dx} = f'(t) \cdot g'(t)$,$\frac{dy}{dx} = \frac{g'(t)}{f'(t)}$,D,Por la regla de la cadena: $\frac{dy}{dx} = \frac{dy/dt}{dx/dt} = \frac{g'(t)}{f'(t)}$.
Curvas,Ecuaciones paramÃĐtricas,facil,"Si $x = 3t$ y $y = 2t + 5$, la ecuacion cartesiana de la curva es:",$y = \frac{2}{3}x + 5$,$y = \frac{3}{2}x + 5$,$y = 2x + 5$,$y = \frac{2}{3}x - 5$,A,De $x = 3t$ se obtiene $t = x/3$. Sustituyendo: $y = 2(x/3) + 5 = \frac{2}{3}x + 5$.
Curvas,Ecuaciones paramÃĐtricas,facil,La tangente a una curva parametrica es horizontal cuando:,$\frac{dx}{dt} = 0$ y $\frac{dy}{dt} \neq 0$,$\frac{dy}{dt} = 0$ y $\frac{dx}{dt} = 0$,$\frac{dy}{dt} = 0$ y $\frac{dx}{dt} \neq 0$,$\frac{dx}{dt} \neq 0$ y $\frac{dy}{dt} \neq 0$,C,"La tangente es horizontal cuando $dy/dx = 0$, es decir $dy/dt = 0$ con $dx/dt \neq 0$."
Curvas,Ecuaciones paramÃĐtricas,medio,"Para la curva $x = t^2$, $y = t^3 - 3t$, la pendiente de la tangente es:",$\frac{3t^2 - 3}{2}$,$\frac{3}{2}\left(t - \frac{1}{t}\right)$,$\frac{2t}{3t^2 - 3}$,$\frac{3t^2 + 3}{2t}$,B,$\frac{dy}{dx} = \frac{3t^2 - 3}{2t} = \frac{3}{2}\left(t - \frac{1}{t}\right)$.
Curvas,Ecuaciones paramÃĐtricas,medio,"Para la curva $x = t^2$, $y = t^3 - 3t$, Âŋen que punto la tangente es vertical?","$(1, -2)$","$(1, 2)$","$(3, 0)$","$(0, 0)$",D,"Tangente vertical cuando $dx/dt = 2t = 0$, es decir $t = 0$. El punto es $(0, 0)$."
Curvas,Ecuaciones paramÃĐtricas,medio,La segunda derivada $\frac{d^2y}{dx^2}$ para una curva parametrica se calcula como:,$\frac{\frac{d}{dt}\left(\frac{dy}{dx}\right)}{\frac{dx}{dt}}$,$\frac{d}{dt}\left(\frac{dy}{dx}\right)$,$\frac{g''(t)}{f''(t)}$,$\frac{d^2y/dt^2}{d^2x/dt^2}$,A,"La formula correcta es $\frac{d^2y}{dx^2} = \frac{d}{dt}(dy/dx) \div \frac{dx}{dt}$, aplicando la regla de la cadena."
Curvas,Ecuaciones paramÃĐtricas,medio,"El area bajo la curva parametrica $x = f(t)$, $y = g(t)$ entre $t = \alpha$ y $t = \beta$ se calcula como:","$A = \int_{\alpha}^{\beta} g(t) \, dt$","$A = \int_{\alpha}^{\beta} f(t) g'(t) \, dt$","$A = \int_{\alpha}^{\beta} g(t) f'(t) \, dt$","$A = \int_{\alpha}^{\beta} f(t) g(t) \, dt$",C,"Por sustitucion: $A = \int y\,dx = \int_{\alpha}^{\beta} g(t) f'(t)\,dt$, donde $dx = f'(t)\,dt$."
Curvas,Ecuaciones paramÃĐtricas,medio,"ÂŋCual es el punto $(x,y)$ sobre la curva $x = 2\cos t$, $y = 2\sin t$ cuando $t = \frac{\pi}{4}$?","$(1, 1)$","$(\sqrt{3}, 1)$","$(2, 0)$","$(\sqrt{2}, \sqrt{2})$",D,"$x = 2\cos(\pi/4) = 2 \cdot \frac{\sqrt{2}}{2} = \sqrt{2}$, $y = 2\sin(\pi/4) = \sqrt{2}$."
Curvas,Ecuaciones paramÃĐtricas,medio,"La curva parametrica $x = a\cos t$, $y = b\sin t$ con $a \neq b$ y $0 \le t \le 2\pi$ describe:",Una circunferencia de radio $a$,Una elipse con semiejes $a$ y $b$,Una hiperbola con semiejes $a$ y $b$,"Una parabola con vertice en $(a, b)$",B,"Al eliminar $t$: $x^2/a^2 + y^2/b^2 = 1$, que es una elipse con semiejes $a$ y $b$."
Curvas,Ecuaciones paramÃĐtricas,medio,"Para la curva $x = t^2$, $y = t^3 - 3t$, Âŋen que puntos la tangente es horizontal?","$(0, 0)$","$(3, 0)$","$(1, 0)$ y $(9, 0)$","$(1, -2)$ y $(1, 2)$",D,"Tangente horizontal cuando $dy/dt = 3t^2 - 3 = 0$, es decir $t = \pm 1$. Para $t=1$: $(1,-2)$; para $t=-1$: $(1,2)$."
Curvas,Ecuaciones paramÃĐtricas,medio,"Dada $x = t^2 - 2t$, $y = t + 1$, la pendiente de la tangente cuando $t = 2$ es:",$\frac{1}{4}$,$\frac{1}{3}$,$\frac{1}{2}$,$1$,C,$\frac{dy}{dx} = \frac{1}{2t - 2}$. En $t = 2$: $\frac{1}{2(2)-2} = \frac{1}{2}$.
Curvas,Ecuaciones paramÃĐtricas,dificil,"La curva $x = t^2$, $y = t^3 - 3t$ pasa dos veces por $(3, 0)$. Las pendientes de las dos tangentes en ese punto son:",$m = \pm\sqrt{3}$,$m = \pm\frac{\sqrt{3}}{3}$,$m = \pm 1$,$m = \pm 3$,A,"En $(3,0)$: $t^2=3 \Rightarrow t=\pm\sqrt{3}$. $\frac{dy}{dx} = \frac{3t^2-3}{2t} = \frac{6}{\pm 2\sqrt{3}} = \pm\sqrt{3}$."
Curvas,Ecuaciones paramÃĐtricas,dificil,"Para la curva $x = t^2$, $y = t^3 - 3t$, la curva es concava hacia arriba cuando:",$t < 0$,$t > 0$,$t > 1$,$t < -1$ o $t > 1$,B,"$d^2y/dx^2 = \frac{3}{4t}(1 + 1/t^2)$. Como $1 + 1/t^2 > 0$ siempre, el signo depende de $1/t$: positivo cuando $t > 0$."
Curvas,Ecuaciones paramÃĐtricas,dificil,"Sea $x = e^t$, $y = e^{-t}$. La ecuacion cartesiana y su dominio son:","$y = -x$, $x \in \mathbb{R}$","$y = x^2$, $x > 0$","$y = \ln x$, $x > 0$","$y = \frac{1}{x}$, $x > 0$",D,"De $x = e^t$: $t = \ln x$. Entonces $y = e^{-\ln x} = 1/x$, con $x = e^t > 0$."
Curvas,Ecuaciones paramÃĐtricas,dificil,"Para la cicloide $x = t - \sin t$, $y = 1 - \cos t$, la pendiente de la tangente en $t = \frac{\pi}{2}$ es:",$0$,$-1$,$1$,$\frac{1}{2}$,C,$\frac{dy}{dx} = \frac{\sin t}{1 - \cos t}$. En $t = \pi/2$: $\frac{1}{1 - 0} = 1$.
Curvas,Ecuaciones paramÃĐtricas,dificil,"La curva $x = \cos t$, $y = \sin t$ parte del punto $(1,0)$ y se recorre en sentido:",Antihorario,Horario,Depende del intervalo de $t$,No se puede determinar,A,"En $t=0$ el punto es $(1,0)$. Para $t$ pequeno: $x$ decrece, $y$ crece, lo que corresponde a sentido antihorario."
Curvas,Ecuaciones paramÃĐtricas,dificil,"Dada $x = t^2 - 2t$, $y = t + 1$, Âŋpara que valor de $t$ la pendiente de la tangente es $\frac{1}{4}$?",$t = 2$,$t = 3$,$t = 4$,$t = 1$,B,$dy/dx = 1/(2t-2)$. Igualando a $1/4$: $2t - 2 = 4 \Rightarrow t = 3$.
Curvas,Curvatura y torsiÃģn,facil,La curvatura $\kappa$ de una curva mide:,Que tan rapido cambia la direccion del vector tangente,La velocidad de la particula,La longitud de la curva,El area bajo la curva,A,La curvatura cuantifica el cambio de direccion del vector tangente por unidad de longitud de arco.
Curvas,Curvatura y torsiÃģn,facil,La curvatura de un circulo de radio $a$ es:,$a$,$\frac{1}{a}$,$a^2$,$\frac{1}{a^2}$,B,"La curvatura del circulo es $\kappa = 1/a$, inversamente proporcional al radio."
Curvas,Curvatura y torsiÃģn,facil,La curvatura de una recta es:,$1$,Infinita,$0$,Indeterminada,C,"Una recta no cambia de direccion, por lo que su curvatura es $\kappa = 0$."
Curvas,Curvatura y torsiÃģn,facil,La torsion $\tau$ de una curva mide:,El cambio de la velocidad,El cambio de la curvatura,La rapidez de la particula,Cuanto se aparta la curva de su plano osculador,D,La torsion mide el retorcimiento de la curva fuera del plano osculador.
Curvas,Curvatura y torsiÃģn,facil,"Si una curva es completamente plana, su torsion es:",$0$,$1$,Infinita,Indefinida,A,"Una curva plana no se retuerce fuera de su plano, por lo que $\tau(t) = 0$."
Curvas,Curvatura y torsiÃģn,facil,La formula de la curvatura usando el producto cruzado es:,"$\kappa = \frac{\lVert\vec{r}\,' \cdot \vec{r}\,''\rVert}{\lVert\vec{r}\,'\rVert^3}$","$\kappa = \frac{\lVert\vec{r}\,''\rVert}{\lVert\vec{r}\,'\rVert}$","$\kappa = \frac{\lVert\vec{r}\,' \times \vec{r}\,''\rVert}{\lVert\vec{r}\,'\rVert^3}$","$\kappa = \frac{\vec{r}\,' \times \vec{r}\,''}{\lVert\vec{r}\,'\rVert^2}$",C,"La formula practica es $\kappa = \lVert\vec{r}\,' \times \vec{r}\,''\rVert / \lVert\vec{r}\,'\rVert^3$."
Curvas,Curvatura y torsiÃģn,medio,"Para la cubica torcida $\vec{r}(t) = \langle t, t^2, t^3 \rangle$, el producto cruzado $\vec{r}\,' \times \vec{r}\,''$ es:","$\langle 6t, -6t^2, 2 \rangle$","$\langle 6t^2, -6t, 2 \rangle$","$\langle 2, -6t, 6t^2 \rangle$","$\langle -6t^2, 6t, 2 \rangle$",B,"$\vec{r}\,' = (1, 2t, 3t^2)$, $\vec{r}\,'' = (0, 2, 6t)$. El determinante da $(6t^2 \cdot 2 - 3t^2 \cdot 6t,...) = (6t^2, -6t, 2)$."
Curvas,Curvatura y torsiÃģn,medio,"La curvatura de $\vec{r}(t) = \langle t, t^2, t^3 \rangle$ en $t = 0$ es:",$0$,$1$,$\sqrt{2}$,$2$,D,"En $t=0$: $\lVert\vec{r}\,' \times \vec{r}\,''\rVert = \lVert(0,0,2)\rVert = 2$, $\lVert\vec{r}\,'\rVert = 1$. $\kappa(0) = 2/1 = 2$."
Curvas,Curvatura y torsiÃģn,medio,"Para una curva plana $y = f(x)$, la curvatura se calcula como:",$\kappa = \frac{\lVert f''(x)\rVert}{[1 + (f'(x))^2]^{3/2}}$,$\kappa = \frac{f''(x)}{1 + (f'(x))^2}$,$\kappa = \frac{f'(x)}{[1 + (f''(x))^2]^{3/2}}$,$\kappa = f''(x)$,A,"Con la parametrizacion $\vec{r}(x) = (x, f(x))$: $\kappa = \lVert f''\rVert / [1+(f')^2]^{3/2}$."
Curvas,Curvatura y torsiÃģn,medio,"La curvatura de la parabola $y = x^2$ en el origen $(0,0)$ es:",$0$,$1$,$2$,$4$,C,"$y' = 2x$, $y'' = 2$. En $x=0$: $\kappa = 2/(1+0)^{3/2} = 2$."
Curvas,Curvatura y torsiÃģn,medio,La formula de la torsion usando las tres primeras derivadas es:,"$\tau = \frac{\vec{r}\,' \cdot \vec{r}\,''}{\lVert\vec{r}\,' \times \vec{r}\,''\rVert^2}$","$\tau = \frac{(\vec{r}\,' \times \vec{r}\,'') \cdot \vec{r}\,'''}{\lVert\vec{r}\,' \times \vec{r}\,''\rVert^2}$","$\tau = \frac{\lVert\vec{r}\,' \times \vec{r}\,'''\rVert}{\lVert\vec{r}\,'\rVert^3}$","$\tau = \frac{\vec{r}\,'' \cdot \vec{r}\,'''}{\lVert\vec{r}\,''\rVert^2}$",B,"La torsion se calcula con el producto mixto escalar: $\tau = (\vec{r}\,' \times \vec{r}\,'') \cdot \vec{r}\,''' / \lVert\vec{r}\,' \times \vec{r}\,''\rVert^2$."
Curvas,Curvatura y torsiÃģn,medio,La curvatura de la parabola $y = x^2$ en $x = 1$ es:,$2$,$\frac{1}{5}$,$\frac{1}{\sqrt{5}}$,$\frac{2}{5\sqrt{5}}$,D,"$y'=2x$, $y''=2$. En $x=1$: $\kappa = 2/(1+4)^{3/2} = 2/5^{3/2} = 2/(5\sqrt{5})$."
Curvas,Curvatura y torsiÃģn,medio,"La torsion de la helice circular $\vec{r}(t) = \langle \alpha\cos t, \alpha\sin t, \beta t \rangle$ es:",$\frac{\beta}{\alpha^2 + \beta^2}$,$\frac{\alpha}{\alpha^2 + \beta^2}$,$\frac{\beta}{\alpha}$,$\frac{1}{\beta}$,A,Usando la formula del producto mixto se obtiene $\tau = \alpha^2\beta / [\alpha^2(\alpha^2+\beta^2)] = \beta/(\alpha^2+\beta^2)$.
Curvas,Curvatura y torsiÃģn,medio,"Si $\beta = 0$ en la helice $\vec{r}(t) = \langle \alpha\cos t, \alpha\sin t, \beta t \rangle$, la torsion es:",$1/\alpha$,Infinita,$0$,$\alpha$,C,Con $\beta = 0$ la curva es un circulo plano: $\tau = 0/(\alpha^2+0) = 0$.
Curvas,Curvatura y torsiÃģn,dificil,"La curvatura de la helice circular $\vec{r}(t) = \langle \alpha\cos t, \alpha\sin t, \beta t \rangle$ es:",$\frac{1}{\alpha}$,$\frac{\alpha}{\alpha^2 + \beta^2}$,$\frac{\beta}{\alpha^2 + \beta^2}$,$\frac{1}{\alpha^2 + \beta^2}$,B,"$\lVert\vec{r}\,' \times \vec{r}\,''\rVert = \alpha\sqrt{\alpha^2+\beta^2}$, $\lVert\vec{r}\,'\rVert^3 = (\alpha^2+\beta^2)^{3/2}$. $\kappa = \alpha/(\alpha^2+\beta^2)$."
Curvas,Curvatura y torsiÃģn,dificil,"Para la cubica torcida $\vec{r}(t) = \langle t, t^2, t^3 \rangle$, $\lVert\vec{r}\,'(t)\rVert$ es:",$\sqrt{1 + 2t + 3t^2}$,$1 + 2t + 3t^2$,$\sqrt{1 + 2t^2 + 3t^4}$,$\sqrt{1 + 4t^2 + 9t^4}$,D,"$\vec{r}\,' = (1, 2t, 3t^2)$. $\lVert\vec{r}\,'\rVert = \sqrt{1 + 4t^2 + 9t^4}$."
Curvas,Curvatura y torsiÃģn,dificil,La curvatura de $y = x^2$ en $x = 2$ es aproximadamente:,"$0{,}03$","$0{,}18$",$2$,"$0{,}5$",A,"$\kappa(2) = 2/(1+16)^{3/2} = 2/17^{3/2} \approx 2/70{,}1 \approx 0{,}03$."
Curvas,Curvatura y torsiÃģn,dificil,"A medida que $x \to \infty$ en la parabola $y = x^2$, la curvatura tiende a:",$\infty$,$2$,$0$,$1$,C,$\kappa(x) = 2/(1+4x^2)^{3/2} \to 0$ cuando $x \to \infty$: la parabola se aplana.
Curvas,Curvatura y torsiÃģn,dificil,"El producto mixto escalar $(\vec{r}\,' \times \vec{r}\,'') \cdot \vec{r}\,'''$ es cero si y solo si la curva es:",Cerrada,De curvatura constante,Una helice,Plana,D,"El producto mixto nulo implica $\tau = 0$, lo cual significa que la curva no se retuerce y es plana."
Curvas,Curvatura y torsiÃģn,dificil,"Para la cubica torcida $\vec{r}(t) = \langle t, t^2, t^3 \rangle$, la curvatura general $\kappa(t)$ es:",$\frac{2}{(1+4t^2+9t^4)^{3/2}}$,$\frac{2\sqrt{9t^4+9t^2+1}}{(1+4t^2+9t^4)^{3/2}}$,$\frac{6t}{(1+4t^2+9t^4)^{3/2}}$,$\frac{\sqrt{36t^4+36t^2+4}}{(1+4t^2+9t^4)^2}$,B,"$\lVert\vec{r}\,' \times \vec{r}\,''\rVert = 2\sqrt{9t^4+9t^2+1}$, $\lVert\vec{r}\,'\rVert^3 = (1+4t^2+9t^4)^{3/2}$."
